{
  "$schema": "https://json-schema.org/draft/2020-12/schema",
  "$id": "urn:diopside:contract:static-json:tag-master:1",
  "title": "diopside tag_master.json",
  "type": "object",
  "required": [
    "schemaVersion",
    "tagMasterVersion",
    "generatedAt",
    "tagTypes",
    "tags"
  ],
  "properties": {
    "schemaVersion": {
      "type": "string",
      "minLength": 1
    },
    "tagMasterVersion": {
      "type": "string",
      "minLength": 1
    },
    "generatedAt": {
      "type": "string",
      "format": "date-time"
    },
    "tagTypes": {
      "type": "array",
      "items": {
        "type": "object",
        "required": [
          "id",
          "key",
          "name",
          "order",
          "singleSelect",
          "requiredPerVideo"
        ],
        "properties": {
          "id": {
            "type": "integer",
            "minimum": 0
          },
          "key": {
            "type": "string",
            "minLength": 1
          },
          "name": {
            "type": "string",
            "minLength": 1
          },
          "order": {
            "type": "integer",
            "minimum": 0
          },
          "singleSelect": {
            "type": "boolean"
          },
          "requiredPerVideo": {
            "type": "boolean"
          }
        },
        "additionalProperties": true
      }
    },
    "tags": {
      "type": "array",
      "items": {
        "oneOf": [
          {
            "type": "array",
            "prefixItems": [
              {
                "type": "integer",
                "minimum": 0
              },
              {
                "type": "string",
                "minLength": 1
              }
            ],
            "minItems": 2,
            "maxItems": 2,
            "items": false
          },
          {
            "type": "array",
            "prefixItems": [
              {
                "type": "integer",
                "minimum": 0
              },
              {
                "type": "string",
                "minLength": 1
              },
              {
                "type": "array",
                "items": {
                  "type": "string"
                }
              }
            ],
            "minItems": 3,
            "maxItems": 3,
            "items": false
          },
          {
            "type": "array",
            "prefixItems": [
              {
                "type": "integer",
                "minimum": 0
              },
              {
                "type": "string",
                "minLength": 1
              },
              {
                "type": "array",
                "items": {
                  "type": "string"
                }
              },
              {
                "type": "boolean"
              }
            ],
            "minItems": 4,
            "maxItems": 4,
            "items": false
          },
          {
            "type": "array",
            "prefixItems": [
              {
                "type": "integer",
                "minimum": 0
              },
              {
                "type": "string",
                "minLength": 1
              },
              {
                "type": "array",
                "items": {
                  "type": "string"
                }
              },
              {
                "type": "boolean"
              },
              {
                "type": [
                  "integer",
                  "null"
                ],
                "minimum": 0
              }
            ],
            "minItems": 5,
            "maxItems": 5,
            "items": false
          }
        ]
      }
    }
  },
  "additionalProperties": true
}
