{
  "schemaVersion": "1.0.0",
  "tagMasterVersion": "ef4b2ffd32d5b54a",
  "generatedAt": "2026-02-04T15:09:26Z",
  "tagTypes": [
    {
      "id": 0,
      "key": "channel",
      "name": "チャンネル",
      "order": 0,
      "singleSelect": true,
      "requiredPerVideo": true
    },
    {
      "id": 1,
      "key": "majorCategory",
      "name": "大分類",
      "order": 1,
      "singleSelect": true,
      "requiredPerVideo": true
    },
    {
      "id": 2,
      "key": "performer",
      "name": "出演者名",
      "order": 2,
      "singleSelect": false,
      "requiredPerVideo": false
    },
    {
      "id": 3,
      "key": "unit",
      "name": "ユニット名",
      "order": 3,
      "singleSelect": false,
      "requiredPerVideo": false
    },
    {
      "id": 4,
      "key": "gameTitle",
      "name": "ゲーム名",
      "order": 4,
      "singleSelect": false,
      "requiredPerVideo": false
    },
    {
      "id": 5,
      "key": "gameGenre",
      "name": "ゲームジャンル",
      "order": 5,
      "singleSelect": false,
      "requiredPerVideo": false
    },
    {
      "id": 6,
      "key": "series",
      "name": "シリーズ名",
      "order": 6,
      "singleSelect": false,
      "requiredPerVideo": false
    },
    {
      "id": 7,
      "key": "contentTitle",
      "name": "コンテンツ名",
      "order": 7,
      "singleSelect": false,
      "requiredPerVideo": false
    },
    {
      "id": 8,
      "key": "contentGenre",
      "name": "コンテンツジャンル",
      "order": 8,
      "singleSelect": false,
      "requiredPerVideo": false
    },
    {
      "id": 9,
      "key": "projectTitle",
      "name": "企画名",
      "order": 9,
      "singleSelect": false,
      "requiredPerVideo": false
    },
    {
      "id": 10,
      "key": "projectMajor",
      "name": "企画大分類",
      "order": 10,
      "singleSelect": true,
      "requiredPerVideo": false
    },
    {
      "id": 11,
      "key": "projectGenre",
      "name": "企画ジャンル",
      "order": 11,
      "singleSelect": false,
      "requiredPerVideo": false
    },
    {
      "id": 12,
      "key": "streamGenre",
      "name": "配信ジャンル",
      "order": 12,
      "singleSelect": false,
      "requiredPerVideo": false
    },
    {
      "id": 13,
      "key": "format",
      "name": "動画形式",
      "order": 13,
      "singleSelect": true,
      "requiredPerVideo": true
    }
  ],
  "tags": [
    [
      0,
      "Choco Ch. 癒月ちょこ"
    ],
    [
      0,
      "Kanae Channel"
    ],
    [
      0,
      "Kazaki Ch. ‐ 森中花咲 ‐"
    ],
    [
      0,
      "Shien Ch.影山シエン"
    ],
    [
      0,
      "Tamaki Ch. 犬山たまき / 佃煮のりお"
    ],
    [
      0,
      "あおぎり高校 - Aogiri Vtuber High School"
    ],
    [
      0,
      "えま★おうがすと / Emma★August【にじさんじ】"
    ],
    [
      0,
      "える / Elu【にじさんじ】"
    ],
    [
      0,
      "こまるCh. - Komaru Kurikoma -/あおぎり高校"
    ],
    [
      0,
      "たみーCh / 民安ともえ"
    ],
    [
      0,
      "でびでび・でびる"
    ],
    [
      0,
      "にじさんじ"
    ],
    [
      0,
      "ぱぱびっぷTRPG"
    ],
    [
      0,
      "ましろ"
    ],
    [
      0,
      "アンジュ・カトリーナ - Ange Katrina -"
    ],
    [
      0,
      "エリー・コニファー / Eli Conifer【にじさんじ】"
    ],
    [
      0,
      "ガッチマンV"
    ],
    [
      0,
      "ガリベンチャーV"
    ],
    [
      0,
      "グウェル・オス・ガール / Gwelu Os Gar 【にじさんじ】"
    ],
    [
      0,
      "シスター・クレア -SisterClaire-"
    ],
    [
      0,
      "フミ/にじさんじ"
    ],
    [
      0,
      "フレン・E・ルスタリオ"
    ],
    [
      0,
      "ベルモンド・バンデラス"
    ],
    [
      0,
      "リゼ・ヘルエスタ -Lize Helesta-"
    ],
    [
      0,
      "ルイス・キャミー"
    ],
    [
      0,
      "レイン・パターソン／Lain Paterson【にじさんじ】"
    ],
    [
      0,
      "レオス・ヴィンセント / Leos.Vincent【にじさんじ】"
    ],
    [
      0,
      "レヴィ・エリファ-Levi Elipha-"
    ],
    [
      0,
      "一橋綾人 / Hitotsubashi Ayato【にじさんじ】"
    ],
    [
      0,
      "不破 湊 / Fuwa Minato【にじさんじ】"
    ],
    [
      0,
      "五十嵐梨花 / Igarashi Rika 【にじさんじ】"
    ],
    [
      0,
      "人生 つみこ (ホラーゲーム専門Vtuber)"
    ],
    [
      0,
      "健屋花那【にじさんじ】KanaSukoya"
    ],
    [
      0,
      "北小路ヒスイ / Kitakoji Hisui 【にじさんじ】"
    ],
    [
      0,
      "叢雲カゲツ / Murakumo Kagetsu【にじさんじ】"
    ],
    [
      0,
      "周央 サンゴ / Suo Sango【にじさんじ】"
    ],
    [
      0,
      "四季凪アキラ / Shikinagi Akira"
    ],
    [
      0,
      "因幡はねる / Haneru Channel【ななしいんく】"
    ],
    [
      0,
      "夜見れな/yorumi rena【にじさんじ所属】"
    ],
    [
      0,
      "天宮 こころ / Amamya Ch."
    ],
    [
      0,
      "姫咲ゆずる / Himesaki Yuzuru"
    ],
    [
      0,
      "愛園 愛美/Aizono Manami"
    ],
    [
      0,
      "成瀬 鳴 / Naruse Naru【にじさんじ】"
    ],
    [
      0,
      "文野環【にじさんじの野良猫】ふみのたまき"
    ],
    [
      0,
      "早瀬 走 / Hayase Sou【にじさんじ所属】"
    ],
    [
      0,
      "星川サラ / Sara Hoshikawa"
    ],
    [
      0,
      "月ノ美兎"
    ],
    [
      0,
      "来栖 夏芽-kurusu natsume-【にじさんじ】"
    ],
    [
      0,
      "柚原いづみ / Izumi Channel 【ななしいんく】"
    ],
    [
      0,
      "栞葉るり / Shioriha Ruri【にじさんじ】"
    ],
    [
      0,
      "桜凛月"
    ],
    [
      0,
      "椎名唯華 / Shiina Yuika"
    ],
    [
      0,
      "海妹四葉 / Umise Yotsuha 【にじさんじ】"
    ],
    [
      0,
      "猫瀬乃しんNekozeno Shin"
    ],
    [
      0,
      "白雪 巴/Shirayuki Tomoe"
    ],
    [
      0,
      "白雪みしろShirayuki Mishiro"
    ],
    [
      0,
      "神田笑一 / Kanda Shoichi【 にじさんじ 】"
    ],
    [
      0,
      "竜胆 尊 / Rindou Mikoto"
    ],
    [
      0,
      "笹木咲 / Sasaki Saku"
    ],
    [
      0,
      "綺沙良 / Kisara【にじさんじ】"
    ],
    [
      0,
      "緑仙 / Ryushen"
    ],
    [
      0,
      "聖女れりあ / Hijirime_Laeria"
    ],
    [
      0,
      "舞元啓介"
    ],
    [
      0,
      "花畑チャイカ"
    ],
    [
      0,
      "西園チグサ / Nishizono Chigusa"
    ],
    [
      0,
      "西園寺メアリ / Mary Channel【ななしいんく】"
    ],
    [
      0,
      "鈴木勝 / Suzuki Masaru【にじさんじ】"
    ],
    [
      0,
      "鏑木ろこ / Kaburaki Roco【にじさんじ】"
    ],
    [
      0,
      "雪城眞尋/Yukishiro Mahiro【にじさんじ所属】"
    ],
    [
      0,
      "響木アオ-HibikiAo-"
    ],
    [
      0,
      "飛鳥ひな【にじさんじ所属】"
    ],
    [
      0,
      "鬼灯わらべHoozuki Warabe【卒業】"
    ],
    [
      0,
      "黒井しば【にじさんじの犬】"
    ],
    [
      1,
      "ASMR"
    ],
    [
      1,
      "Short"
    ],
    [
      1,
      "TRPG"
    ],
    [
      1,
      "ゲーム"
    ],
    [
      1,
      "企画"
    ],
    [
      1,
      "同時視聴"
    ],
    [
      1,
      "歌"
    ],
    [
      1,
      "罵倒/SM"
    ],
    [
      1,
      "踊ってみた"
    ],
    [
      1,
      "雑談"
    ],
    [
      2,
      "Hex Haywire"
    ],
    [
      2,
      "Kotoka Torahime"
    ],
    [
      2,
      "えま★おうがすと"
    ],
    [
      2,
      "える"
    ],
    [
      2,
      "アルス・アルマル"
    ],
    [
      2,
      "アンジュ・カトリーナ"
    ],
    [
      2,
      "エクス・アルビオ"
    ],
    [
      2,
      "エリー・コニファー"
    ],
    [
      2,
      "オリバー・エバンス"
    ],
    [
      2,
      "ギルザレンⅢ世"
    ],
    [
      2,
      "グウェル・オス・ガール"
    ],
    [
      2,
      "シェリン・バーガンディ"
    ],
    [
      2,
      "シスター・クレア"
    ],
    [
      2,
      "ジョー・力一"
    ],
    [
      2,
      "ニュイ・ソシエール"
    ],
    [
      2,
      "フミ"
    ],
    [
      2,
      "モイラ"
    ],
    [
      2,
      "リゼ・ヘルエスタ"
    ],
    [
      2,
      "レイン・パターソン"
    ],
    [
      2,
      "レオス・ヴィンセント"
    ],
    [
      2,
      "レヴィ・エリファ"
    ],
    [
      2,
      "ローレン・イロアス"
    ],
    [
      2,
      "一橋綾人"
    ],
    [
      2,
      "七瀬すず菜"
    ],
    [
      2,
      "三枝明那"
    ],
    [
      2,
      "不破湊"
    ],
    [
      2,
      "五十嵐梨花"
    ],
    [
      2,
      "伏見ガク"
    ],
    [
      2,
      "健屋花那"
    ],
    [
      2,
      "剣持刀也"
    ],
    [
      2,
      "北小路ヒスイ"
    ],
    [
      2,
      "叢雲カゲツ"
    ],
    [
      2,
      "叶"
    ],
    [
      2,
      "周央サンゴ"
    ],
    [
      2,
      "四季凪アキラ"
    ],
    [
      2,
      "夕刻ロベル"
    ],
    [
      2,
      "夕陽リリ"
    ],
    [
      2,
      "夜空メル"
    ],
    [
      2,
      "夜見れな"
    ],
    [
      2,
      "夢追翔"
    ],
    [
      2,
      "天宮こころ"
    ],
    [
      2,
      "姫咲ゆずる"
    ],
    [
      2,
      "宇志海いちご"
    ],
    [
      2,
      "安土桃"
    ],
    [
      2,
      "宗谷いちか"
    ],
    [
      2,
      "家長むぎ"
    ],
    [
      2,
      "弦月藤士郎"
    ],
    [
      2,
      "影山シエン"
    ],
    [
      2,
      "愛園愛美"
    ],
    [
      2,
      "成瀬鳴"
    ],
    [
      2,
      "文野環"
    ],
    [
      2,
      "早瀬走"
    ],
    [
      2,
      "星川サラ"
    ],
    [
      2,
      "春崎エアル"
    ],
    [
      2,
      "来栖夏芽"
    ],
    [
      2,
      "栞葉るり"
    ],
    [
      2,
      "森中花咲"
    ],
    [
      2,
      "椎名唯華"
    ],
    [
      2,
      "樋口楓"
    ],
    [
      2,
      "海妹四葉"
    ],
    [
      2,
      "渋谷ハジメ"
    ],
    [
      2,
      "瀬戸美夜子"
    ],
    [
      2,
      "犬山たまき"
    ],
    [
      2,
      "猫瀬乃しん"
    ],
    [
      2,
      "甲斐田晴"
    ],
    [
      2,
      "癒月ちょこ"
    ],
    [
      2,
      "白上フブキ"
    ],
    [
      2,
      "白雪みしろ"
    ],
    [
      2,
      "相羽ういは"
    ],
    [
      2,
      "神田笑一"
    ],
    [
      2,
      "空澄セナ"
    ],
    [
      2,
      "竜胆尊"
    ],
    [
      2,
      "童田明治"
    ],
    [
      2,
      "笹木咲"
    ],
    [
      2,
      "綺沙良"
    ],
    [
      2,
      "緑仙"
    ],
    [
      2,
      "聖女れりあ"
    ],
    [
      2,
      "葛葉"
    ],
    [
      2,
      "蝸堂みかる"
    ],
    [
      2,
      "西園チグサ"
    ],
    [
      2,
      "西園寺メアリ"
    ],
    [
      2,
      "鈴木勝"
    ],
    [
      2,
      "鏑木ろこ"
    ],
    [
      2,
      "雪城眞尋"
    ],
    [
      2,
      "風見くく"
    ],
    [
      2,
      "飛鳥ひな"
    ],
    [
      2,
      "魔使マオ"
    ],
    [
      2,
      "魔界ノりりむ"
    ],
    [
      2,
      "鷹宮リオン"
    ],
    [
      2,
      "黒井しば"
    ],
    [
      2,
      "黛灰"
    ],
    [
      3,
      "BBB"
    ],
    [
      3,
      "Crossick"
    ],
    [
      3,
      "VIØLLETTA"
    ],
    [
      3,
      "VOLTACTION"
    ],
    [
      3,
      "W白雪コラボ"
    ],
    [
      3,
      "しばとも(仮)"
    ],
    [
      3,
      "にじさんじラジオ体操部"
    ],
    [